{
  "id": "graph_f142eb66-16b5-446c-9c00-d86437d0f009",
  "schemaVersion": "1.0",
  "workflowId": "wf_2fcc23cd-a520-43ae-893b-d24bd5d8703e",
  "rootGoal": "research typescript agent frameworks",
  "status": "draft",
  "strategy": "sequential",
  "nodes": [
    {
      "id": "node_c6a81977-a651-4da3-86c2-f2a2f7a61006",
      "graphId": "graph_f142eb66-16b5-446c-9c00-d86437d0f009",
      "title": "Execute task",
      "goal": "research typescript agent frameworks",
      "domain": "legacy",
      "status": "ready",
      "dependencies": [],
      "requiredCapabilities": [],
      "riskLevel": "low",
      "approvalMode": "auto",
      "inputs": {
        "goal": "research typescript agent frameworks"
      },
      "artifacts": [],
      "memoryRefs": [],
      "createdAt": "2026-06-08T15:16:20.136Z",
      "updatedAt": "2026-06-08T15:16:20.136Z"
    }
  ],
  "edges": [],
  "createdAt": "2026-06-08T15:16:20.136Z",
  "updatedAt": "2026-06-08T15:16:20.136Z"
}