{
  "id": "graph_24c6530a-c9db-418b-8f53-074f459b45c9",
  "schemaVersion": "1.0",
  "workflowId": "wf_22c64533-e1d7-4dc5-acea-11b360756921",
  "rootGoal": "vector databases",
  "status": "draft",
  "strategy": "sequential",
  "nodes": [
    {
      "id": "scope_topic",
      "graphId": "graph_24c6530a-c9db-418b-8f53-074f459b45c9",
      "title": "Define research scope",
      "goal": "Define the research scope for: vector databases. Output 3-5 research questions. Use ONLY web_search. Do NOT read local project files.",
      "domain": "research",
      "status": "pending",
      "dependencies": [],
      "requiredCapabilities": [
        "web.search"
      ],
      "riskLevel": "low",
      "approvalMode": "auto",
      "inputs": {},
      "artifacts": [],
      "memoryRefs": [],
      "createdAt": "2026-06-08T16:48:13.403Z",
      "updatedAt": "2026-06-08T16:48:13.403Z",
      "executionProfile": "research"
    },
    {
      "id": "search_sources",
      "graphId": "graph_24c6530a-c9db-418b-8f53-074f459b45c9",
      "title": "Search for sources",
      "goal": "Search the web for sources related to: vector databases. Use ONLY web_search. Do NOT read local project files. Find at least 5 credible sources.",
      "domain": "research",
      "status": "pending",
      "dependencies": [
        "scope_topic"
      ],
      "requiredCapabilities": [
        "web.search"
      ],
      "riskLevel": "low",
      "approvalMode": "auto",
      "inputs": {},
      "artifacts": [],
      "memoryRefs": [],
      "createdAt": "2026-06-08T16:48:13.403Z",
      "updatedAt": "2026-06-08T16:48:13.403Z",
      "executionProfile": "research"
    },
    {
      "id": "extract_claims",
      "graphId": "graph_24c6530a-c9db-418b-8f53-074f459b45c9",
      "title": "Extract claims from sources",
      "goal": "Review the search results and extract key claims. Map each claim to its source URL. Note any contradictions. Use ONLY the provided search results. Do NOT read local project files.",
      "domain": "research",
      "status": "pending",
      "dependencies": [
        "search_sources"
      ],
      "requiredCapabilities": [
        "web.search"
      ],
      "riskLevel": "low",
      "approvalMode": "auto",
      "inputs": {},
      "artifacts": [],
      "memoryRefs": [],
      "createdAt": "2026-06-08T16:48:13.403Z",
      "updatedAt": "2026-06-08T16:48:13.403Z",
      "executionProfile": "research"
    },
    {
      "id": "synthesize",
      "graphId": "graph_24c6530a-c9db-418b-8f53-074f459b45c9",
      "title": "Synthesize report",
      "goal": "Write a structured research report about: vector databases. Use the extracted claims. Separate facts from interpretations. Include a conclusions section. Use ONLY the extracted claims. Do NOT access the web or local files.",
      "domain": "research",
      "status": "pending",
      "dependencies": [
        "extract_claims"
      ],
      "requiredCapabilities": [],
      "riskLevel": "low",
      "approvalMode": "auto",
      "inputs": {},
      "artifacts": [],
      "memoryRefs": [],
      "createdAt": "2026-06-08T16:48:13.403Z",
      "updatedAt": "2026-06-08T16:48:13.403Z",
      "executionProfile": "research"
    },
    {
      "id": "critic_review",
      "graphId": "graph_24c6530a-c9db-418b-8f53-074f459b45c9",
      "title": "Critic review",
      "goal": "Review the synthesized report. Check for: unsupported claims, source concentration, missing citations, logical gaps. Use ONLY the provided report. Do NOT access the web or local files.",
      "domain": "research",
      "status": "pending",
      "dependencies": [
        "synthesize"
      ],
      "requiredCapabilities": [],
      "riskLevel": "low",
      "approvalMode": "auto",
      "inputs": {},
      "artifacts": [],
      "memoryRefs": [],
      "createdAt": "2026-06-08T16:48:13.403Z",
      "updatedAt": "2026-06-08T16:48:13.403Z",
      "executionProfile": "research"
    },
    {
      "id": "write_artifacts",
      "graphId": "graph_24c6530a-c9db-418b-8f53-074f459b45c9",
      "title": "Write report artifacts",
      "goal": "Write the final report, sources list, claims mapping, and critic review to the artifacts directory: .alix/reports/report_1780937293402/. Only write files under .alix/reports/. Do NOT read or write project source files.",
      "domain": "research",
      "status": "pending",
      "dependencies": [
        "critic_review"
      ],
      "requiredCapabilities": [
        "filesystem.write"
      ],
      "riskLevel": "low",
      "approvalMode": "auto",
      "inputs": {},
      "artifacts": [],
      "memoryRefs": [],
      "createdAt": "2026-06-08T16:48:13.403Z",
      "updatedAt": "2026-06-08T16:48:13.403Z",
      "executionProfile": "research"
    }
  ],
  "edges": [
    {
      "id": "e1_graph_24c6530a-c9db-418b-8f53-074f459b45c9",
      "graphId": "graph_24c6530a-c9db-418b-8f53-074f459b45c9",
      "from": "scope_topic",
      "to": "search_sources",
      "type": "requires"
    },
    {
      "id": "e2_graph_24c6530a-c9db-418b-8f53-074f459b45c9",
      "graphId": "graph_24c6530a-c9db-418b-8f53-074f459b45c9",
      "from": "search_sources",
      "to": "extract_claims",
      "type": "requires"
    },
    {
      "id": "e3_graph_24c6530a-c9db-418b-8f53-074f459b45c9",
      "graphId": "graph_24c6530a-c9db-418b-8f53-074f459b45c9",
      "from": "extract_claims",
      "to": "synthesize",
      "type": "requires"
    },
    {
      "id": "e4_graph_24c6530a-c9db-418b-8f53-074f459b45c9",
      "graphId": "graph_24c6530a-c9db-418b-8f53-074f459b45c9",
      "from": "synthesize",
      "to": "critic_review",
      "type": "requires"
    },
    {
      "id": "e5_graph_24c6530a-c9db-418b-8f53-074f459b45c9",
      "graphId": "graph_24c6530a-c9db-418b-8f53-074f459b45c9",
      "from": "critic_review",
      "to": "write_artifacts",
      "type": "requires"
    }
  ],
  "createdAt": "2026-06-08T16:48:13.402Z",
  "updatedAt": "2026-06-08T16:48:13.402Z"
}